{
  "schema": "AVER_TM_REQUEST",
  "schema_version": "1.0",
  "request_id": "d7.20260914.spreadsheets-life-make-sense",
  "wording": "MAYBE WITH ENOUGH SPREADSHEETS LIFE WILL MAKE SENSE",
  "intended_goods_context": {
    "primary_class": "016",
    "coordinated_classes": ["025"],
    "description": "Printed vinyl stickers and decals bearing humorous spreadsheet and office-culture wording for laptops, water bottles, notebooks and similar personal display surfaces; apparel adjacency reviewed only for related-goods analysis.",
    "channels": ["US online marketplaces", "direct-to-consumer sticker shops"],
    "purchasers": ["data analysts", "accountants", "spreadsheet-centric professionals", "overthinkers and coworker gift buyers"]
  },
  "requested_scope": {
    "country": "US",
    "federal_registry": true,
    "related_goods_review": true,
    "query_dimensions": ["EXACT", "NORMALIZED_EXACT", "CORE_DOMINANT_TOKEN", "EXPANDED_PARTIAL", "PHONETIC_OR_SPELLING_WHEN_MATERIAL", "RELATED_GOODS_REVIEW"]
  },
  "caller": {
    "system": "Amazon-Daily7Source",
    "reference": "runs/2026-09-14-1003-live-verification-fresh/research-evidence-1124.json#h-spreadsheets-life-make-sense"
  }
}
